title,slug,organization_name,facility_name,description,engage,content,featured_image,category,modes,formats,centerings,street_address,city,state,zip,region,country,latitude,longitude,phone,email,website,expiration_date,source_url,scraped_url
Creative Mentoring & Day Program for Homeless Youth,,P:ear,,"A welcoming daytime drop-in space for young people moving through and beyond homelessness — creative mentoring, education, art, recreation, meals, and referrals. Serves about 65 youth a day. Open Tuesday–Friday, 9am–2pm.","Visit P:ear at 338 NW 6th Ave, Portland (Tue–Fri 9am–2pm) or call 503-228-6677. Review eligibility and what to expect at pearmentor.org before your first visit.","<h2>Programs</h2><ul><li><b>Core Programs:</b> education, arts, and recreation</li><li><b>Meals:</b> over 23,000 served a year</li><li><b>Support:</b> referrals and parenting support</li></ul><h2>Who It's For</h2><p>Young people experiencing or transitioning out of homelessness.</p><h2>Hours</h2><p>Tuesday–Friday, 9am–2pm, at 338 NW 6th Ave, Portland.</p>",,Day Center,In Person,Services,Youth & Children,338 NW 6th Ave,Portland,Oregon,97209,,United States,45.5257641,-122.6762240,503-228-6677,info@pearmentor.org,https://www.pearmentor.org/,,https://www.pearmentor.org/,https://www.pearmentor.org/
Works Job Training Program,,P:ear,,P:ear's job-training and paid work-experience program helping homeless and transitional youth build employment skills and a work history.,"Ask P:ear staff about the Works program during a visit, or call 503-228-6677.","<h2>Program</h2><p>The Works programs give young people job training and real work experience — building skills, confidence, and employment history as they move beyond homelessness.</p><h2>Who It's For</h2><p>Homeless and transitional youth ready to build job skills.</p>",,Employment & Career,In Person,Services,Youth & Children,338 NW 6th Ave,Portland,Oregon,97209,,United States,45.5257641,-122.6762240,503-228-6677,info@pearmentor.org,https://www.pearmentor.org/,,https://www.pearmentor.org/,https://www.pearmentor.org/
Recovery Meetings & Community Center,,Alano Club of Portland,,"A free, inclusive recovery community center in NW Portland hosting 100+ recovery meetings a week (AA, NA, and other peer groups), plus online meeting access. Open to anyone seeking recovery from substance use and mental health challenges for 60+ years.","Drop in at 909 NW 24th Ave, Portland, or call 503-222-5756. Meeting schedules at alanoclub.org. All services are free.","<h2>What's Offered</h2><ul><li>100+ in-person recovery meetings weekly (AA, NA, and more)</li><li>Access to online recovery meetings</li><li>Specialized programs: Recovery Toolkit, Peer Connect (peer matching), Artists in Recovery, Project Red (overdose prevention)</li></ul><h2>Who It's For</h2><p>Anyone seeking recovery from substance use and/or mental health disorders.</p><h2>Cost</h2><p>Free.</p>",,Peer Support,In Person; Online,Services,People in Recovery,909 NW 24th Ave,Portland,Oregon,97210,,United States,45.5292560,-122.7009323,503-222-5756,,,,,https://www.portlandalano.org/home
Free Recovery Classes & Workshops,,Alano Club of Portland,,"A rotating lineup of free classes and workshops for people in recovery — legal aid clinics, financial literacy, arts classes, cooking workshops (Plates for the People), sound baths, and more, across multiple locations.",See the current class schedule at alanoclub.org or call 503-222-5756. All classes are free.,"<h2>Offerings</h2><ul><li>Legal aid clinics</li><li>Financial literacy</li><li>Arts classes and Artists in Recovery</li><li>Cooking / nutrition workshops (Plates for the People)</li><li>Sound baths and wellness sessions</li></ul><h2>Who It's For</h2><p>People in recovery seeking skills, connection, and wellness. Free and open.</p>",,Skill Building,In Person,"Classes, Workshops & Meetings",People in Recovery,909 NW 24th Ave,Portland,Oregon,97210,,United States,45.5292560,-122.7009323,503-222-5756,,,,,https://www.portlandalano.org/home
Accessible Housing & Attendant Care,,QUAD,,"Affordable, barrier-free (wheelchair-accessible) apartments plus optional 24/7 resident-directed attendant care for adults with physical disabilities, across five Portland-area communities. Designed for independent living with roll-in showers, roll-under counters, and emergency systems.","Apply online at quadinc.org/services/application-process, or call 503-287-4260.","<h2>Services</h2><ul><li><b>Accessible Housing:</b> studio, 1-, and 2-bedroom wheelchair-accessible apartments with open floor plans, roll-under counters, custom appliances, and roll-in showers</li><li><b>24/7 Shared Attendant Care (optional):</b> resident-directed help with daily living — wake-up care, cooking, medical assistance, and community activities</li><li><b>Community amenities:</b> common rooms, gardens, and emergency assistance systems</li></ul><h2>Locations</h2><p>Myers Court (N Portland), Central Station (Gresham), Rolling Green (Hillsboro), Burnside Station and Station 162 (E Portland).</p><h2>Who It's For</h2><p>Adults with physical disabilities seeking accessible, supportive independent living.</p>",,Housing,In Person; By Appointment Only,Services,People with Disabilities,"6645 NE 78th Court, C-7",Portland,Oregon,97218,,United States,45.5708167,-122.5824444,503-287-4260,development@quadinc.org,https://quadinc.org/,,https://quadinc.org/,https://quadinc.org/
Mental Health Counseling,,Quest Center for Integrative Health,,"Therapy and counseling for emotional wellness from an integrative-health nonprofit, with in-person and telehealth options.",Call 503-238-5203 or email info@quest-center.org to schedule mental health services.,"<h2>Program</h2><p>Individual therapy and counseling supporting emotional and mental wellness, offered through an integrative, whole-person approach. Telehealth available.</p>",,Mental & Behavioral Health,In Person; Online,Services,,3231 SE 50th Ave,Portland,Oregon,97206,,United States,45.4990592,-122.6116297,503-238-5203,info@quest-center.org,https://quest-center.org/mental-health-services,,https://quest-center.org/mental-health-services,https://quest-center.org/
FSR Addiction Services,,Quest Center for Integrative Health,,"Substance-use counseling and recovery support (FSR) integrated with whole-person wellness, available in person and via telehealth.",Call 503-238-5203 or email info@quest-center.org for addiction services.,"<h2>Program</h2><p>Counseling and recovery support for substance use, delivered within Quest's integrative-health model. Telehealth counseling available.</p>",,Recovery,In Person; Online,Services,People in Recovery,3231 SE 50th Ave,Portland,Oregon,97206,,United States,45.4990592,-122.6116297,503-238-5203,info@quest-center.org,https://quest-center.org/fsr-addiction-services,,https://quest-center.org/fsr-addiction-services,https://quest-center.org/
HIV Services,,Quest Center for Integrative Health,,"Specialized, integrative healthcare and wellness support for people living with HIV.",Call 503-238-5203 or email info@quest-center.org to access HIV services.,"<h2>Program</h2><p>Integrative healthcare and wellness support tailored to people living with HIV, coordinated with Quest's medical, mental health, and nutrition services.</p><h2>Who It's For</h2><p>People living with HIV.</p>",,Medical,In Person; Online,Services,Living with HIV,3231 SE 50th Ave,Portland,Oregon,97206,,United States,45.4990592,-122.6116297,503-238-5203,info@quest-center.org,https://quest-center.org/hiv-services,,https://quest-center.org/hiv-services,https://quest-center.org/
Integrative Medical & Primary Care,,Quest Center for Integrative Health,,"Primary healthcare integrated with Quest's wellness services, including pain management (WISH) and nutrition support — a whole-person approach to health.",Call 503-238-5203 or email info@quest-center.org to establish care.,"<h2>Services</h2><ul><li>Primary healthcare</li><li>WISH pain management for chronic or acute pain</li><li>Nutrition counseling</li></ul><p>Care is integrated across Quest's medical, mental health, and wellness programs.</p>",,Medical,In Person; Online,Services,,3231 SE 50th Ave,Portland,Oregon,97206,,United States,45.4990592,-122.6116297,503-238-5203,info@quest-center.org,https://quest-center.org/medical-care,,https://quest-center.org/medical-care,https://quest-center.org/
Transitional Housing,,Quest Center for Integrative Health,,Residential transitional housing support helping Quest clients gain stability as part of their integrative health and recovery.,Call 503-238-5203 or email info@quest-center.org to ask about transitional housing.,"<h2>Program</h2><p>Transitional housing and residential support integrated with Quest's health and recovery services, helping clients stabilize.</p>",,Housing,In Person,Services,,3231 SE 50th Ave,Portland,Oregon,97206,,United States,45.4990592,-122.6116297,503-238-5203,info@quest-center.org,https://quest-center.org/transitional-housing,,https://quest-center.org/transitional-housing,https://quest-center.org/
Radical Hospitality Gatherings,,Rahab's Sisters,,"Weekly hospitality gatherings offering nourishing meals, supplies, community, and genuine connection for women, trans, and nonbinary people experiencing poverty, homelessness, isolation, and street-based survival. No questions asked.",Email info@rahabs-sisters.org or call 971-208-3176 to find the current gathering time and location.,"<h2>What's Offered</h2><ul><li>Nourishing hot meals</li><li>Clothing, hygiene, and safety supplies</li><li>Warm, judgment-free community and connection</li></ul><h2>Who It's For</h2><p>Women, trans, and nonbinary folks facing poverty, homelessness, and isolation — including people in street-based survival economies.</p><h2>How to Access</h2><p>Come to a weekly gathering. Contact Rahab's Sisters for the current time and place.</p>",,Food; Clothing; Toiletries,In Person,Services,Women; LGBTQIA2S+,,Portland,Oregon,,,United States,,,971-208-3176,info@rahabs-sisters.org,https://rahabs-sisters.org/,,https://rahabs-sisters.org/,https://rahabs-sisters.org/
Bilingual Latine Mental Health Services,,Raíces de Bienestar,,"Culturally-grounded, bilingual and bicultural mental health services for Latine communities — from prevention and community education to clinical therapy, offered via telehealth and mobile services. Staff are hired from the communities they serve.",New patients: submit the intake form at forms.gle/BbYkErFs5Svng7mB9. Call (971) 417-6054 with questions. Existing patients use the portal at rdb.mytheranest.com.,"<h2>Services</h2><ul><li><b>Community Liberation Programs:</b> prevention activities and trauma-informed community education</li><li><b>Clinical Mental Health:</b> bilingual/bicultural therapy via telehealth and mobile services</li><li><b>Training & Consultation:</b> culturally-responsive mental health practice for providers</li></ul><h2>Who It's For</h2><p>Latine individuals, families, community leaders, and traditional health workers in Oregon.</p><h2>Language</h2><p>Bilingual and bicultural — services in Spanish and English.</p>",,Mental & Behavioral Health,In Person; Online,Services,Spanish Speakers; BIPOC,"2920 SE Brookwood Ave, Suite A",Hillsboro,Oregon,97123,,United States,45.4988103,-122.9302666,971-417-6054,,https://www.raicesdebienestar.org/,,https://www.raicesdebienestar.org/,https://www.raicesdebienestar.org/
Recovery Resource Directory,,Recovery Network of Oregon,,"A free statewide online tool connecting people to recovery support across all 36 Oregon counties — medical care and treatment, peer services, recovery meetings, health & wellness, financial resources, and housing. Search by your situation and county, or connect with a peer supporter.","Search recovery resources for free at recoverynetworkoforegon.org — pick your situation (getting sober, thriving in recovery, using more safely) and your county.","<h2>What It Offers</h2><p>A searchable directory built on the principle that ""every path to recovery is valid,"" connecting people to:</p><ul><li>Medical care & treatment</li><li>Peer services and peer supporters</li><li>Recovery meetings</li><li>Health & wellness</li><li>Financial resources</li><li>Housing & shelter</li></ul><h2>Who It's For</h2><p>Anyone in recovery — those just starting, using more safely, in long-term recovery, and their family and friends. Covers all 36 Oregon counties.</p>",,Recovery,Online,Guidebooks,People in Recovery,,,,,,United States,,,,,https://recoverynetworkoforegon.org/,,https://recoverynetworkoforegon.org/,https://recoverynetworkoforegon.org/
Detox (Withdrawal Management),,Recovery Works NW,,"24/7 medically-supervised inpatient detox at the Foster Road location, providing a safe start to recovery. Accepts OHP and most major insurance.",Call (503) 906-9995 for a confidential assessment and insurance verification.,"<h2>Program</h2><p>Around-the-clock, medically-supervised inpatient withdrawal management to safely detox from alcohol and other drugs, with medication support as appropriate.</p><h2>Insurance</h2><p>Accepts OHP, Aetna, BCBS, Cigna, United Healthcare, and Moda. Located at Foster Road Detox, Portland.</p>",,Detox,In Person,Services,People in Recovery; Low Barrier,,Portland,Oregon,,,United States,,,503-906-9995,info@recoveryworksnw.com,https://www.recoveryworksnw.com/,,https://www.recoveryworksnw.com/,https://www.recoveryworksnw.com/
"Outpatient Treatment, MAT & Mental Health",,Recovery Works NW,,"Judgment-free outpatient addiction treatment with individual and group counseling, medication-assisted treatment (Suboxone, Vivitrol), and mental health therapy for trauma, depression, anxiety, and co-occurring disorders. Locations in Portland, Tigard, and Newberg.",Call (503) 906-9995 to get started and verify coverage (OHP and most insurance accepted).,"<h2>Services</h2><ul><li>Outpatient individual and group counseling</li><li>Medication-assisted treatment (Suboxone, Vivitrol)</li><li>Mental health therapy for trauma, depression, anxiety, and co-occurring disorders</li><li>Peer support from certified specialists</li></ul><h2>Locations</h2><p>Portland, Tigard, and Newberg.</p>",,Recovery,In Person; Online,Services,People in Recovery,,Portland,Oregon,,,United States,,,503-906-9995,info@recoveryworksnw.com,https://www.recoveryworksnw.com/,,https://www.recoveryworksnw.com/,https://www.recoveryworksnw.com/
DUII Diversion Program,,Recovery Works NW,,"State-certified DUII diversion program helping people meet court and DMV requirements, with assessment, education, and treatment.",Call (503) 906-9995 to enroll in the DUII diversion program.,"<h2>Program</h2><p>A state-certified program fulfilling court and DMV DUII requirements, including assessment, alcohol/drug education, and treatment as needed.</p><h2>Who It's For</h2><p>Individuals with DUII charges or diversion requirements.</p>",,Recovery,In Person,Services,Justice Impacted,,Portland,Oregon,,,United States,,,503-906-9995,info@recoveryworksnw.com,https://www.recoveryworksnw.com/,,https://www.recoveryworksnw.com/,https://www.recoveryworksnw.com/
Medical Detox (Referral-Based),,Rose City Detox,,"Focused medical detoxification in a private, campus-style setting with 24/7 clinical supervision, high staff-to-client ratio, private rooms, case management, and discharge planning. Referral-based admissions only (no walk-ins). Accepts OHP and most insurance.",Admissions are referral-based by appointment — call 503-919-3199 for a referral and insurance verification. No walk-ins.,"<h2>Program</h2><p>Medically-supervised detox with round-the-clock clinical supervision in a private, campus-style setting. Includes case management and discharge planning to connect you to next steps.</p><h2>Substances Treated</h2><p>Alcohol, opioids, fentanyl, heroin, cocaine, methamphetamine, prescription drugs, and hallucinogens.</p><h2>Access & Insurance</h2><p>Referral-based admissions only, by appointment — no walk-ins. Accepts Oregon Health Plan and most insurance. Does not provide emergency medical services.</p>",,Detox,In Person; By Appointment Only,Services,People in Recovery,12711 SE Holgate Blvd,Portland,Oregon,97236,,United States,45.4897045,-122.5330705,503-919-3199,,https://www.rosecitydetox.com/,,https://www.rosecitydetox.com/,https://www.rosecitydetox.com/
